①,지방세나 공과금의 체납처분을 할 때 그 체납처분금액 중에서 국세·가산금 또는 체납처분비를 징수하는 경우 그 지방세나 공과금의 체납처분비는 국세·가산금 또는 체납처분비보다 우선하여 징수한다.
②,"강제집행·경매 또는 파산 절차에 따라 재산을 매각할 때 그 매각금액 중에서 국세·가산금·체납처분비를 징수하는 경우 그 강제집행, 경매 또는 파산 절차에 든 비용은 국세·가산금 또는 체납처분비보다 우선하여 징수한다."
③,과세표준과 세액을 정부가 결정·경정 또는 수시부과 결정을 하는 경우 고지한 해당 세액에 대한 법정기일은 그 납세고지서의 발송일이다.
④,저당권이 설정된 토지에 대하여 부과된 종합부동산세는 그 설정일이 종합부동산세의 법정기일 후인 경우에는 그 저당권에 의하여 담보된 채권에 우선하지 못한다.
"⑤",「주택임대차보호법」이 적용되는 임대차관계에 있는 주택을 매각할 때 그 매각금액 중에서 국세나 가산금을 징수하는 경우 임대차에 관한 보증금 중 임차인이 우선하여 변제받을 수 있는 금액에 관한 채권은 국세·가산금 또는 체납처분비보다 우선하여 징수한다.
