①,특수관계인 외의 자에게 정당한 사유 없이 자산을 정상가액보다 낮은 가액으로 양도하는 경우 정상가액과 양도가액의 차액은 기부금에 포함한다.
②,법인이 기부금을 금전 외의 자산으로 제공한 경우 특수관계인이 아닌 자에게 기부한 일반기부금은 기부했을 때의 장부가액과 시가 중 큰 금액으로 해당 자산가액을 산정한다.
③,법령에 따라 특별재난지역으로 선포된 경우 그 선포의 사유가 된 재난으로 생기는 이재민을 위한 구호금품의 가액은 특례기부금이다.
④,내국법인이 각 사업연도에 지출하는 일반기부금 중 손금산입한도액을 초과하여 손금에 산입하지 아니한 금액은 해당 사업연도의 다음 사업연도 개시일부터 10년 이내에 끝나는 각 사업연도로 이월하여 그 이월된 사업연도의 소득금액을 계산할 때 손금산입한도액의 범위에서 손금에 산입한다.
"⑤","내국법인이 각 사업연도에 지출하는 기부금을 이연계상한 경우에는 이를 그 지출한 사업연도의 기부금으로 하고, 그 후의 사업연도에 있어서는 이를 기부금으로 보지 아니한다."
