항목,주요 내용 요약
①,검토인은 재무제표가 중요하게 왜곡표시 될 수 있는 상황이 존재한다는 전문가적 의구심을 갖고 검토계획을 수립하고 검토업무를 수행
②,분기검토는 검토의 대상이 되는 정보에 중요한 왜곡표시가 없다는 것에 대한 보통수준의 확신을 제공할 수 있도록 계획되며 이와 같은 확신은 적극적 확신의 형태로 보고서에 표시
③,감사와 비교할 경우 검토업무는 수행하는 절차가 한정되어 있으므로 감사업무수행시에 비하여 중요성의 판단기준을 완화하여 적용한다.  
④,검토인은 검토보고서가 당해 회사에 전달되는 시점까지 발생된 사건에 대해서 검토절차를 수행하여야 한다.
⑤,"비교 표시된 분기재무제표에 대하여 검토의견을 표명하는 경우, 직전회계연도의 재무제표에 대하여 타감사인이 감사한 경우에는 직전회계연도 감사인의 명칭, 감사의견, 감사보고서 일자 그리고 비교 표시된 대차대조표 및 손익계산서가 감사받은 직전회계연도말 현재의 대차대조표 및 손익계산서와 중요성의 관점에서 차이가 없는지 여부에 대하여 별도문단으로 의견을 표명한다."
