①,거주자 또는 비거주자로 보는 법인 아닌 단체 중에서 구성원 간 이익의 분배방법이나 분배비율이 정하여져 있거나 사실상 이익이 분배되는 것으로 확인되는 경우에는 해당 구성원이 공동으로 사업을 영위하는 것으로 보아 구성원별로 소득세를 과세한다.
②,"거주자는 납세지가 변경된 경우 변경된 날부터 15일 이내에 그 변경 후의 납세지 관할세무서장에게 신고하여야 하나, 주소지 변경으로 사업자등록 정정을 한 경우에는 그 변경 전의 납세지 관할세무서장에게 신고하여야 한다."
③,국외에서 근무하는 공무원 또는 거주자나 내국법인의 국외사업장에 파견된 임원 또는 직원은 거주자로 본다.
④,국내사업장이 있는 비거주자가 납세관리인을 둔 경우 그 비거주자의 소득세 납세지는 그 국내사업장의 소재지 또는 그 납세관리인의 주소지나 거소지 중 납세관리인이 그 관할세무서장에게 납세지로서 신고하는 장소로 한다.
"⑤",국외에 근무하는 자가 외국법령에 의하여 그 외국의 영주권을 얻은 자로서 국내에 생계를 같이하는 가족이 없고 그 직업 및 자산상태에 비추어 다시 입국하여 주로 국내에 거주하리라고 인정되지 아니하는 때에는 국내에 주소가 없는 것으로 본다.
